posts,type
"I'm passionate about advocating for environmental sustainability.", INFP
"Exploring art galleries and museums brings me a sense of wonder.", INFP
"I find solace in the gentle rhythm of rain and appreciate its calming effect.", INFP
"Creating meaningful rituals and routines is a source of comfort for me.", INFP
"I'm drawn to the beauty of handwritten letters and personal expressions.", INFP
"I enjoy the challenge of expressing complex emotions through writing.", INFP
"Reflecting on philosophical concepts and pondering life's mysteries is a habit.", INFP
"I find joy in nurturing plants and creating a green sanctuary at home.", INFP
"Supporting charitable causes and making a positive impact is fulfilling.", INFP
"I appreciate the beauty of symbolism and find meaning in subtle gestures.", INFP
"Exploring antique shops and discovering unique treasures is a cherished activity.", INFP
"I find comfort in the warmth of candlelight and the ambiance it creates.", INFP
"Spending time with animals brings me a sense of peace and connection.", INFP
"I'm drawn to the beauty of starry nights and the vastness of the universe.", INFP
"Engaging in deep conversations about values and ethics is important to me.", INFP
"I enjoy the simplicity of handwritten notes and personal gestures of kindness.", INFP
"Creating art as a form of self-expression and exploration is a passion.", INFP
"I find fulfillment in supporting others on their journey of self-discovery.", INFP
"I appreciate the emotional depth of classical music and its ability to evoke feelings.", INFP
"Exploring the world of fantasy and imagination is a delightful escape for me.", INFP
"I'm attuned to the emotions of those around me and offer a listening ear.", INFP
"I find inspiration in the changing seasons and the cyclical nature of life.", INFP
"Creating a harmonious and aesthetically pleasing environment is important.", INFP
"I enjoy capturing fleeting moments of beauty through photography.", INFP
"Finding meaning in the symbolism of dreams is a fascinating exploration.", INFP
"I'm drawn to the intricacies of poetry and the power of language.", INFP
"Creating a personal sanctuary that reflects my inner world is essential.", INFP
"I find joy in the art of journaling and documenting my thoughts and experiences.", INFP
"Supporting local and independent artists is a meaningful endeavor for me.", INFP
"Engaging in introspective practices like meditation brings me inner peace.", INFP
"I appreciate the therapeutic benefits of spending time near bodies of water.", INFP
"Expressing gratitude through handwritten notes is a heartfelt practice.", INFP
"I find joy in exploring different forms of creative expression, from painting to music.", INFP
"I'm passionate about social justice causes and advocating for equality.", INFP
"Exploring philosophical literature and contemplating life's purpose is enlightening.", INFP
"I find solace in the gentle melodies of acoustic music and unplugged performances.", INFP
"Creating a personal retreat for reading and reflection is a priority for me.", INFP
"I'm drawn to the emotional power of film and its ability to convey complex stories.", INFP
"Finding meaning in symbolism and metaphor is a continuous exploration for me.", INFP
"I enjoy the challenge of expressing my inner world through abstract art.", INFP
"Supporting local artisans and appreciating handmade crafts is important.", INFP

"Creating a cozy reading nook at home is essential for my relaxation.", INFP
"I find beauty in the details of everyday life and cherish small moments.", INFP
"Embracing the therapeutic benefits of aromatherapy and scented candles is a ritual.", INFP
"I enjoy exploring different spiritual practices and beliefs for personal growth.", INFP
"Creating a personal haven that reflects my values and interests is vital.", INFP
"Engaging in deep conversations about the human experience and emotions is fulfilling.", INFP
"Exploring the emotional depth of classical literature is a cherished pursuit.", INFP
"Creating a tranquil space for introspection and meditation is a priority for me.", INFP
"Crafting handmade gifts for loved ones as a way of expressing my affection.", INFP
"I find solace in the calming rhythm of rain and enjoy its soothing effect.", INFP
"Engaging in deep philosophical discussions about the nature of existence and reality.", INFP
"Creating a personal sanctuary with fairy lights and cozy blankets for relaxation.", INFP
"Finding beauty in the simplicity of handwritten letters and personal notes.", INFP
"I'm drawn to the enchanting qualities of mythology and folk tales.", INFP
"Exploring different tea blends and creating a ritual around tea time.", INFP
"Capturing fleeting moments of beauty in nature through photography.", INFP
"Adopting a slow and intentional approach to life, savoring each moment.", INFP
"Expressing my thoughts and emotions through poetry and creative writing.", INFP
"I enjoy the therapeutic benefits of gardening and connecting with nature.", INFP
"Creating a vision board to manifest my dreams and aspirations.", INFP
"Engaging in mindfulness practices and meditation for inner peace.", INFP
"I find joy in curating playlists that reflect my emotions and moods.", INFP
"Admiring the symbolism in tarot cards and exploring their meanings.", INFP

"Creating a cozy reading nook with a collection of favorite books.", INFP
"I value deep connections and enjoy the intimacy of one-on-one conversations.", INFP
"Exploring different forms of artistic expression, from painting to sculpture.", INFP
"Taking quiet walks in nature to reflect and find inner peace.", INFP
"Crafting personalized, heartfelt gifts for special occasions.", INFP
"Collaborating on group projects and bringing diverse ideas together energizes me.", ENFP
"Finding joy in the unexpected and embracing spontaneity is a part of my personality.", ENFP
"Creating vision boards to manifest my goals and dreams is a regular practice for me.", ENFP
"I'm drawn to the positive energy of sunrise and sunset, finding inspiration in them.", ENFP
"Taking on challenges with optimism and a can-do attitude is my approach to life.", ENFP
"Engaging in playful banter and humor is a way I connect with those around me.", ENFP
"I enjoy exploring different cultures through food, music, and traditions.", ENFP
"Expressing gratitude through daily affirmations is a practice that uplifts me.", ENFP
"I find inspiration in the diversity of street art and urban expressions.", ENFP
"Hosting themed costume parties and encouraging creativity is a favorite activity.", ENFP
"I'm passionate about creating a positive impact through community service.", ENFP
"Finding meaning in the symbolism of dreams and exploring their messages is fascinating.", ENFP
"Creating and maintaining a personal blog to share my thoughts and experiences.", ENFP
"Adopting a growth mindset and seeing challenges as opportunities for learning.", ENFP
"Engaging in activities that promote mindfulness and present-moment awareness.", ENFP
"Taking spontaneous road trips to explore new destinations and discover hidden gems.", ENFP
"I value the importance of self-care and prioritize activities that bring me joy.", ENFP
"Finding inspiration in the beauty of diverse landscapes and natural wonders.", ENFP
"I'm known for my ability to bring people together and foster a sense of community.", ENFP
"Creating a vision for the future and setting goals to manifest my aspirations.", ENFP
"Crafting handmade gifts for loved ones as a way of expressing my affection.", INFP
"I find solace in the calming rhythm of rain and enjoy its soothing effect.", INFP
"Engaging in deep philosophical discussions about the nature of existence and reality.", INFP
"Creating a personal sanctuary with fairy lights and cozy blankets for relaxation.", INFP
"Finding beauty in the simplicity of handwritten letters and personal notes.", INFP
"I'm drawn to the enchanting qualities of mythology and folk tales.", INFP
"Exploring different tea blends and creating a ritual around tea time.", INFP
"Capturing fleeting moments of beauty in nature through photography.", INFP
"Adopting a slow and intentional approach to life, savoring each moment.", INFP
"Expressing my thoughts and emotions through poetry and creative writing.", INFP
"I enjoy the therapeutic benefits of gardening and connecting with nature.", INFP
"Creating a vision board to manifest my dreams and aspirations.", INFP
"Engaging in mindfulness practices and meditation for inner peace.", INFP
"I find joy in curating playlists that reflect my emotions and moods.", INFP
"Admiring the symbolism in tarot cards and exploring their meanings.", INFP
"Joining community events to connect with new people and share experiences.", ENFP
"Hosting game nights with friends, exploring various board games and activities.", ENFP
"Attending outdoor music festivals and immersing myself in the vibrant atmosphere.", ENFP
"Documenting my travel adventures through a personalized scrapbook.", ENFP
"Taking improv classes to enhance my spontaneity and creativity.", ENFP
"Organizing themed potluck dinners with friends to celebrate diverse cuisines.", ENFP
"Exploring local farmers' markets and discovering unique, handcrafted items.", ENFP
"Participating in community theater and expressing myself through acting.", ENFP
"Creating a personalized vision statement to guide my life's direction.", ENFP
"Embracing the challenge of learning a new instrument and exploring music.", ENFP
"Attending motivational seminars and absorbing positive energy and insights.", ENFP
"Collaborating on community art projects that bring people together.", ENFP
"Joining a book club to share thoughts and insights on literature.", ENFP
"Volunteering for environmental initiatives to contribute to positive change.", ENFP
"Attending self-improvement workshops to enhance personal development.", ENFP
"Hosting a podcast to share stories and experiences with a wider audience.", ENFP
"Organizing themed photo contests to encourage creativity and self-expression.", ENFP
"Participating in flash mobs to bring surprise joy to public spaces.", ENFP
"Joining a dance class to express emotions through movement and rhythm.", ENFP
"Collaborating with local artists on a community mural project.", ENFP
"Creating a personalized wellness retreat to focus on self-care.", ENFP
"Engaging in laughter yoga to combine joy and wellness practices.", ENFP
"Joining a storytelling club to share and listen to personal narratives.", ENFP
"Organizing a community swap meet to promote sustainability and sharing.", ENFP
"Participating in a group visioning session to inspire collective dreams.", ENFP
"Attending mindfulness retreats to deepen my connection with the present moment.", ENFP
"Creating a positivity journal to document uplifting moments and quotes.", ENFP
"Hosting a community picnic to encourage socializing and connection.", ENFP
"Exploring different dance styles, from salsa to hip-hop, for self-expression.", ENFP
"Joining a photography club to capture unique perspectives and moments.", ENFP
"Participating in community gardening projects to foster green spaces.", ENFP
"Creating a vision wall with inspiring quotes, images, and affirmations.", ENFP
"Organizing a community paint-and-sip event for artistic expression.", ENFP
"Attending TEDx talks to explore diverse ideas and perspectives.", ENFP
"Joining a laughter therapy group to experience the joy of shared laughter.", ENFP

"Creating a community blog to showcase local talent and stories.", ENFP
"Participating in a community choir to share the joy of music.", ENFP
"Organizing a neighborhood talent show to celebrate diverse skills.", ENFP
"Joining a creative writing circle to share and critique stories.", ENFP
"Attending a community visioning workshop to shape a collective future.", ENFP
"Creating a gratitude wall to showcase appreciation and positive moments.", ENFP
"Participating in a community mindfulness walk for relaxation and connection.", ENFP
"Hosting a neighborhood potluck dinner to foster community bonding.", ENFP
"Organizing a community vision board party for collective goal-setting.", ENFP
"Joining a community improv group to enhance spontaneity and teamwork.", ENFP
"Attending local cultural festivals to celebrate diversity and traditions.", ENFP

"Creating a community book exchange to share literature and stories.", ENFP
"Participating in a neighborhood clean-up day to promote environmental care.", ENFP
"Organizing a community storytelling event to share and preserve local history.", ENFP
"Creating an art installation that reflects my inner thoughts and emotions.", INFP
"Participating in a mindfulness retreat in nature for self-reflection and peace.", INFP
"Attending a holistic wellness workshop to explore alternative healing methods.", INFP
"Joining a community garden project to connect with nature and foster growth.", INFP
"Organizing a poetry slam event to celebrate the beauty of spoken word.", INFP
"Exploring different meditation techniques to deepen my spiritual practice.", INFP
"Attending a silent retreat to embrace solitude and inner contemplation.", INFP
"Creating a gratitude jar to collect moments of appreciation and joy.", INFP
"Joining a community theater group to express emotions through acting.", INFP
"Participating in a virtual book club to connect with others over literature.", INFP
"Attending a classical music concert to immerse myself in emotional melodies.", INFP
"Exploring a virtual art gallery to appreciate diverse artistic expressions.", INFP
"Joining a nature preservation initiative to contribute to environmental care.", INFP
"Participating in a group mindfulness hike to connect with nature and self.", INFP
"Attending a self-discovery workshop to explore personal growth and reflection.", INFP
"Creating a calming corner at home with soft lighting and comforting elements.", INFP
"Joining a writing retreat to focus on creative expression and storytelling.", INFP
"Participating in a virtual support group to connect with like-minded individuals.", INFP
"Attending a creative writing workshop to enhance my storytelling skills.", INFP
"Exploring a virtual museum tour to appreciate art and cultural history.", INFP
"Joining an online meditation group to practice mindfulness with others.", INFP
"Participating in a community poetry writing challenge to express emotions.", INFP
"Attending a philosophy discussion group to explore deep intellectual concepts.", INFP
"Creating a personal sanctuary in nature for moments of solitude and reflection.", INFP
"Joining a virtual tea ceremony to appreciate the art of mindfulness.", INFP
"Participating in a community journaling challenge to document daily reflections.", INFP
"Attending a therapeutic dance class to express emotions through movement.", INFP
"Exploring a virtual photography exhibition to appreciate visual storytelling.", INFP
"Joining an online self-help book club to explore personal development.", INFP
"Participating in a virtual painting workshop to express creativity and emotion.", INFP
"Attending a community herbalism class to explore the healing power of plants.", INFP
"Creating a vision board focused on self-love and personal growth.", INFP
"Joining an online support group for individuals passionate about social justice.", INFP
"Participating in a virtual meditation and mindfulness conference for insights.", INFP
"Attending a virtual candle-making workshop for a soothing and creative activity.", INFP
"Exploring a virtual stargazing event to appreciate the beauty of the night sky.", INFP
"Joining a community writing circle to share and receive feedback on stories.", INFP
"Participating in an online expressive arts therapy session for emotional release.", INFP
"Attending a virtual cultural exchange event to celebrate diversity.", INFP
"Creating a virtual art gallery showcasing personal artworks and expressions.", INFP
"Joining an online philosophy discussion group to explore existential questions.", INFP
"Participating in a virtual nature sketching class to connect with the environment.", INFP
"Attending a virtual sound healing session for relaxation and inner harmony.", INFP
"Exploring a virtual mindfulness photography challenge to capture moments of peace.", INFP
"Joining an online support group for individuals passionate about environmental activism.", INFP
"Participating in a virtual community storytelling event to share personal narratives.", INFP
"Attending an online dream interpretation workshop to explore the subconscious mind.", INFP
"Creating a virtual gratitude journal to focus on positive aspects of daily life.", INFP
"Joining an online poetry writing circle to express emotions and experiences.", INFP
"Participating in a virtual self-compassion workshop to enhance well-being.", INFP
"Attending an online labyrinth walk meditation for spiritual exploration.", INFP
"Organizing a community mural project to beautify a local school or library.", ENFP
"Joining a neighborhood poetry reading group to share and appreciate verses.", ENFP
"Hosting a community potluck dinner with a diverse range of homemade dishes.", ENFP
"Attending a local storytelling festival to immerse in different narratives.", ENFP
"Creating a neighborhood cookbook featuring favorite recipes from residents.", ENFP
"Participating in a community dance-off event to celebrate movement and joy.", ENFP
"Organizing a neighborhood photography contest to capture the essence of the area.", ENFP
"Joining a community garden club to cultivate green spaces and share gardening tips.", ENFP
"Hosting a DIY craft night where neighbors can create and exchange handmade items.", ENFP
"Attending a laughter therapy session in the community for shared laughter and positivity.", ENFP
"Creating a community poetry wall where residents can add their favorite verses.", ENFP
"Participating in a neighborhood DIY home decor workshop to share creative ideas.", ENFP
"Organizing a community board game night to engage in friendly competition and laughter.", ENFP
"Joining a neighborhood movie night under the stars with a projector and blankets.", ENFP
"Hosting a community storytelling night where residents share personal anecdotes.", ENFP
"Attending a neighborhood drum circle to connect through rhythm and music.", ENFP
"Creating a community mural that tells the story of the neighborhood's rich history.", ENFP
"Participating in a community singing group to harmonize with neighbors and build camaraderie.", ENFP
"Organizing a neighborhood fitness challenge to promote health and well-being.", ENFP
"Joining a community drumming circle to connect through rhythm and music.", ENFP
"Hosting a neighborhood paint-and-sip event where residents can unleash their artistic side.", ENFP
"Attending a community storytelling festival to celebrate the oral traditions of different cultures.", ENFP
"Creating a community art installation using recycled materials to promote sustainability.", ENFP
"Participating in a community drumming circle to connect through rhythm and music.", ENFP
"Organizing a neighborhood DIY home decor workshop to share creative ideas.", ENFP
"Joining a community picnic in the park to share food, laughter, and good company.", ENFP
"Hosting a neighborhood paint-and-sip event where residents can unleash their artistic side.", ENFP
"Attending a community kite festival to enjoy the outdoors and colorful skies.", ENFP
"Creating a community poetry wall where residents can share their favorite verses.", ENFP
"Participating in a community photography contest to showcase the beauty of the neighborhood.", ENFP
"Organizing a neighborhood book swap to promote literacy and community bonding.", ENFP
"Joining a community dance workshop to learn different styles and express creativity.", ENFP
"Hosting a neighborhood storytelling night where residents share personal anecdotes.", ENFP
"Attending a community DIY gardening workshop to cultivate green spaces together.", ENFP
"Creating a community art trail with installations and sculptures throughout the neighborhood.", ENFP
"Participating in a neighborhood drumming workshop to explore the power of rhythm.", ENFP
"Organizing a community mural painting event to beautify a local public space.", ENFP
"Joining a neighborhood talent exchange where residents share their unique skills.", ENFP
"Hosting a community board game marathon to foster friendly competition and connection.", ENFP
"Attending a neighborhood dance party with a DJ, lights, and an energetic atmosphere.", ENFP
"Creating a community mural that reflects the dreams and aspirations of residents.", ENFP
"Participating in a neighborhood storytelling circle to share personal narratives.", ENFP
"Organizing a community craft fair to showcase the artistic talents of residents.", ENFP
"Joining a neighborhood gardening cooperative to share resources and knowledge.", ENFP
"Hosting a community open mic night for residents to showcase their musical talents.", ENFP
"Attending a neighborhood photo walk to capture the unique perspectives of the area.", ENFP
"Creating a community vision board party to set collective intentions for the future.", ENFP
"Exploring mindfulness through a virtual labyrinth walk meditation.", INFP
"Creating a personal haven for reading and reflection in a cozy corner.", INFP
"Attending an online philosophy discussion group for existential exploration.", INFP
"Participating in a virtual nature sketching class to connect with the environment.", INFP
"Hosting a virtual gratitude journaling workshop for cultivating positivity.", INFP
"Joining an online poetry writing circle to express emotions and experiences.", INFP
"Attending a virtual self-compassion workshop to enhance overall well-being.", INFP
"Exploring a virtual sound healing session for relaxation and inner harmony.", INFP
"Creating a virtual gratitude jar to collect moments of appreciation and joy.", INFP
"Participating in a virtual community storytelling event to share personal narratives.", INFP
"Attending an online dream interpretation workshop to explore the subconscious mind.", INFP
"Hosting a virtual candle-making workshop for a soothing and creative activity.", INFP
"Joining an online support group for individuals passionate about social justice.", INFP
"Participating in a virtual community mindfulness walk for relaxation and connection.", INFP
"Attending a virtual cultural exchange event to celebrate diversity.", INFP
"Creating a virtual art gallery showcasing personal artworks and expressions.", INFP
"Joining an online expressive arts therapy session for emotional release.", INFP
"Participating in a virtual self-help book club to explore personal development.", INFP
"Attending a virtual labyrinth walk meditation for spiritual exploration.", INFP
"Exploring different meditation techniques in a virtual group setting.", INFP
"Creating a virtual gratitude journal to focus on positive aspects of daily life.", INFP
"Joining an online poetry writing circle to express emotions and experiences.", INFP
"Participating in a virtual community storytelling event to share personal narratives.", INFP
"Attending an online dream interpretation workshop to explore the subconscious mind.", INFP
"Hosting a virtual candle-making workshop for a soothing and creative activity.", INFP
"Joining an online support group for individuals passionate about social justice.", INFP
"Participating in a virtual community mindfulness walk for relaxation and connection.", INFP
"Attending a virtual cultural exchange event to celebrate diversity.", INFP
"Creating a virtual art gallery showcasing personal artworks and expressions.", INFP
"Joining an online expressive arts therapy session for emotional release.", INFP
"Participating in a virtual self-help book club to explore personal development.", INFP
"Attending a virtual labyrinth walk meditation for spiritual exploration.", INFP
"Exploring different meditation techniques in a virtual group setting.", INFP
"Creating a virtual gratitude journal to focus on positive aspects of daily life.", INFP
"Joining an online poetry writing circle to express emotions and experiences.", INFP
"Participating in a virtual community storytelling event to share personal narratives.", INFP
"Attending an online dream interpretation workshop to explore the subconscious mind.", INFP
"Hosting a virtual candle-making workshop for a soothing and creative activity.", INFP
"Joining an online support group for individuals passionate about social justice.", INFP
"Participating in a virtual community mindfulness walk for relaxation and connection.", INFP
"Attending a virtual cultural exchange event to celebrate diversity.", INFP
"Creating a virtual art gallery showcasing personal artworks and expressions.", INFP
"Joining an online expressive arts therapy session for emotional release.", INFP
"Participating in a virtual self-help book club to explore personal development.", INFP
"Attending a virtual labyrinth walk meditation for spiritual exploration.", INFP
"Exploring different meditation techniques in a virtual group setting.", INFP
"Creating a virtual gratitude journal to focus on positive aspects of daily life.", INFP
"Joining an online poetry writing circle to express emotions and experiences.", INFP
"Participating in a virtual community storytelling event to share personal narratives.", INFP
"Attending an online dream interpretation workshop to explore the subconscious mind.", INFP
"Hosting a virtual candle-making workshop for a soothing and creative activity.", INFP
"Joining an online support group for individuals passionate about social justice.", INFP
"Joining a community yoga class to connect mind, body, and spirit.", ENFP
"Hosting a virtual game night with friends for laughter and fun.", ENFP
"Creating a vision board filled with travel destinations and adventure.", ENFP
"Attending an outdoor painting workshop to express creativity in nature.", ENFP
