posts,type
"I love going to parties and meeting new people. The more, the merrier!", ENFP
"I'm always excited to explore new places and make new friends.", ENFP
"You prefer a close circle of friends", INFP
"Thinking out loud",INFP
"You love being inside the four walls of your room without wanting to go out for hours.", INFP
"You avoid eye contact with most people while talking to them.", INFP
"You have very few friends with whom you are very open but avoid making new ones.", INFP
"Tending to act first before thinking", INFP
"You go out for morning walk to enjoy the nature rather than to actually exercise.", INFP
"When you are on a vacation, you enjoy things that others don't. You observe more than anyone else.", INFP
"Out in the mall, when you see someone who knows you, you start going in the opposite direction to avoid meeting him/her.", INFP
"You are reading books on weekends.", INFP
"You are SUPER crazy about correctness of grammar.", INFP
"You have an insecurity somewhere in your heart (regarding anything - looks, height, career, relationships etc.), but you are perfectly able to hide it from others.", INFP
"You are less fearless than others. But you do know the line between confidence and overconfidence.", INFP
"You tend to daydream more than others. You love the virtual world you have created.", INFP
"You are egoistic. You deny that.", INFP
"You love being inside the four walls of your room without wanting to go out for hours.", INFP
"You avoid eye contact with most people while talking to them.", INFP
"You have very few friends with whom you are very open but avoid making new ones.", INFP
"You go out for morning walk to enjoy the nature rather than to actually exercise.", INFP
"When you are on a vacation, you enjoy things that others don't. You observe more than anyone else.", INFP
"Out in the mall, when you see someone who knows you, you start going in the opposite direction to avoid meeting him/her.", INFP
"You are reading books on weekends.", INFP
"You are SUPER crazy about correctness of grammar.", INFP
"You have an insecurity somewhere in your heart (regarding anything - looks, height, career, relationships etc.), but you are perfectly able to hide it from others.", INFP
"You are less fearless than others. But you do know the line between confidence and overconfidence.", INFP
"You tend to daydream more than others. You love the virtual world you have created.", INFP
"You are egoistic. You deny that.", INFP
"You don't worry much about fashion.", INFP
"You are always thinking about something. Many times, you think more than necessary. You can sometimes be very optimistic but adhere to pessimism at other times.", INFP
"You are often fighting with the personalities within yourself.", INFP
"You tend to get depressed more than others. Sometimes you care about things too much and end up hurting your own image in yourself.", INFP
"You never ask your crush out. That ‘taking the time’ phase does not end.", INFP
"When someone asks you out, you first think 'S/He is surely kidding. All this is a prank. How can someone like me?'", INFP
"If you are in a relationship, you would do anything that makes your partner happy. That includes giving up some of your introverted nature.", INFP
"You avoid parties altogether; or make sure you have a way out.", INFP
"You are not lazy, you are just not interested at all.", INFP
"You avoid reading WhatsApp messages especially from those not so close to you, so that you remain unseen.", INFP
"You, VERRRRYYYY rarely, post or share anything on Facebook.", INFP
"You are amazingly talented, but prefer to practice it all alone inside your room. You’re actually afraid of being harshly judged.", INFP
"You have a concept of religion that no one else has.", INFP
"You do not want to share your Playlist, as your choices are very different from those of others.", INFP
"You always prefer e-mail over calling.", INFP
"Your heartbeats race when the phone rings. If the doorbell rings, you get a heart attack.", INFP
"You mentally prepare for phone calls.", INFP
"You are allergic to phrases like 'team player,' 'ice breakers,' and 'pushy salespeople.'", INFP
"Communal tables at coffee places are never an option.", INFP
"You don’t really know how to pull out a weapon of flirtation. So, you continue to stare and it gets awkward. To the point when you want to flush yourself down the toilet.", INFP
"You think for one millisecond before acting on impulse.", INFP
"Lectures over seminars on any day.", INFP
"You have to recharge at the end of the day because you feel drained, even if you genuinely enjoyed every minute of it.", INFP
"You think that some people talk for the sake of having their mouth go up and down, with occasional lip twerking.", INFP
"You have a strict list full of boundaries mentally outlining who is your 'friend' and who is an 'acquaintance.'", INFP
"When you want to leave your condo, but the neighbor is in the hallway. The struggle is phenomenal.", INFP
"You find solace in spending hours lost in thought, exploring the depths of your imagination.", INFP
"You have a knack for finding beauty in the mundane, often losing yourself in the intricacies of everyday life.", INFP
"Your creativity knows no bounds, as you pour your heart and soul into your artistic endeavors.", INFP
"You feel deeply connected to nature, finding peace and inspiration in its serene landscapes.", INFP
"Music speaks to your soul, evoking emotions and memories that resonate deeply within you.", INFP
"You cherish moments of solitude, relishing the opportunity to reflect and recharge your spirit.", INFP
"Empathy flows through your veins, as you strive to understand the emotions and experiences of others.", INFP
"You possess a vivid inner world, brimming with colorful characters and fantastical landscapes.", INFP
"Philosophy captivates your mind, as you ponder the mysteries of existence and the meaning of life.", INFP
"Your heart guides you on your journey, as you navigate the twists and turns of fate with grace and intuition.", INFP
"You don't worry much about fashion.", INFP
"You are always thinking about something. Many times, you think more than necessary. You can sometimes be very optimistic but adhere to pessimism at other times.", INFP
"You are often fighting with the personalities within yourself.", INFP
"You tend to get depressed more than others. Sometimes you care about things too much and end up hurting your own image in yourself.", INFP
"You never ask your crush out. That ‘taking the time’ phase does not end.", INFP
"When someone asks you out, you first think 'S/He is surely kidding. All this is a prank. How can someone like me?'", INFP
"If you are in a relationship, you would do anything that makes your partner happy. That includes giving up some of your introverted nature.", INFP
"You avoid parties altogether; or make sure you have a way out.", INFP
"You are not lazy, you are just not interested at all.", INFP
"You avoid reading WhatsApp messages especially from those not so close to you, so that you remain unseen.", INFP
"You, VERRRRYYYY rarely, post or share anything on Facebook.", INFP
"You are amazingly talented, but prefer to practice it all alone inside your room. You’re actually afraid of being harshly judged.", INFP
"You have a concept of religion that no one else has.", INFP
"You do not want to share your Playlist, as your choices are very different from those of others.", INFP
"You always prefer e-mail over calling.", INFP
"Your heartbeats race when the phone rings. If the doorbell rings, you get a heart attack.", INFP
"Being in a crowd energizes me, and I love socializing with diverse people.", ENFP
"I find joy in spontaneous adventures and thrive in dynamic social environments.", ENFP
"Connecting with others on a deep level is one of my favorite things.", ENFP
"I enjoy sharing my thoughts and ideas with a wide audience.", ENFP
"Large gatherings inspire me, and I feel a sense of belonging in social events.", ENFP
"I often seek out new experiences and enjoy the thrill of the unknown.", ENFP
"Meeting new people brings a sense of excitement and curiosity.", ENFP
"I love expressing myself through various forms of creative expression.", ENFP
"I enjoy being the center of attention and engaging in lively conversations.", ENFP
"I find inspiration in the diversity of people and perspectives around me.", ENFP
"Exploring new cultures and meeting people from different backgrounds is thrilling.", ENFP
"I'm naturally outgoing and love to bring energy to social gatherings.", ENFP
"Spending time with friends and sharing experiences is a top priority for me.", ENFP
"I thrive in social situations and love the buzz of a vibrant social scene.", ENFP
"Building connections with others is a fundamental part of who I am.", ENFP
"I'm always up for a social event and enjoy the company of others.", ENFP
"Expressing my emotions openly and connecting with others is important to me.", ENFP
"I value the richness of social interactions and the diversity of human connections.", ENFP
"Engaging in group activities is something I find truly fulfilling.", ENFP
"I feel alive when surrounded by people, and I cherish my social circles.", ENFP
"I'm naturally drawn to social events and enjoy meeting new faces.", ENFP
"I love the thrill of socializing and discovering new aspects of people's personalities.", ENFP
"I find joy in building relationships and connecting with others authentically.", ENFP
"Sharing my experiences with a wide audience is something I enjoy.", ENFP
"Being in the midst of a lively social gathering brings me a sense of joy.", ENFP
"Exploring the world with others is an enriching experience for me.", ENFP
"I'm happiest when I'm surrounded by a diverse group of friends.", ENFP
"I enjoy the spontaneity of social events and the energy they bring.", ENFP
"Meeting new people and making connections is an exciting part of my life.", ENFP
"Being the life of the party and creating memorable moments is my forte.", ENFP
"I find fulfillment in social interactions and the exchange of ideas.", ENFP
"I love engaging with others and find inspiration in the stories they share.", ENFP
"Spontaneous plans and last-minute adventures with friends are my favorite.", ENFP
"Building a wide network of friends and acquaintances is something I prioritize.", ENFP
"I'm naturally drawn to social situations and enjoy the excitement they bring.", ENFP
"I value the depth of connections I can create with others.", ENFP
"Sharing my passions with a receptive audience brings me a sense of fulfillment.", ENFP
"I thrive in social environments and enjoy connecting with people on a personal level.", ENFP
"Being at the center of social events and engaging with others is invigorating for me.", ENFP
"I'm always open to meeting new people and expanding my social circles.", ENFP
"Expressing my thoughts and emotions through social interactions is essential for me.", ENFP
"I find joy in making new connections and creating bonds with others.", ENFP
"I'm naturally sociable and enjoy engaging with a wide range of personalities.", ENFP
"I love being in the company of friends and sharing experiences with them.", ENFP
"Spontaneous outings and social gatherings are my preferred way to spend time.", ENFP
"I enjoy the vibrant energy of social events and connecting with others.", ENFP
"I thrive in social settings and value the connections I can build with others.", ENFP
"Being the life of the party and creating a positive atmosphere is something I enjoy.", ENFP
"I find joy in the shared experiences and connections I make with others.", ENFP
"Spending time with a group of friends brings me a sense of happiness.", ENFP
"I'm naturally outgoing and enjoy initiating conversations with new people.", ENFP
"I find fulfillment in the diversity of human connections and social interactions.", ENFP
"I enjoy the excitement of meeting new people and exploring different social scenes.", ENFP
"Creating memorable moments with friends and loved ones is important to me.", ENFP
"I value the richness of social interactions and the diversity of personalities.", ENFP
"Being in the company of friends and loved ones is something I cherish.", ENFP
"Engaging in social events and connecting with others is a source of joy for me.", ENFP
"I find inspiration in the dynamic nature of social interactions and relationships.", ENFP
"I'm naturally drawn to social gatherings and enjoy the lively atmosphere they bring.", ENFP
"Meeting new people and making connections is an integral part of my life.", ENFP
"I enjoy being the center of attention and bringing positive energy to social situations.", ENFP
"Expressing my thoughts and emotions through social interactions is essential for me.", ENFP
"I find joy in making new connections and creating bonds with others.", ENFP
"I'm naturally sociable and enjoy engaging with a wide range of personalities.", ENFP
"I love being in the company of friends and sharing experiences with them.", ENFP
"Spontaneous outings and social gatherings are my preferred way to spend time.", ENFP
"I enjoy the vibrant energy of social events and connecting with others.", ENFP
"I thrive in social settings and value the connections I can build with others.", ENFP
"Being the life of the party and creating a positive atmosphere is something I enjoy.", ENFP
"I find joy in the shared experiences and connections I make with others.", ENFP
"Spending time with a group of friends brings me a sense of happiness.", ENFP
"I'm naturally outgoing and enjoy initiating conversations with new people.", ENFP
"I find fulfillment in the diversity of human connections and social interactions.", ENFP
"I enjoy the excitement of meeting new people and exploring different social scenes.", ENFP
"Creating memorable moments with friends and loved ones is important to me.", ENFP
"I value the richness of social interactions and the diversity of personalities.", ENFP
"Being in the company of friends and loved ones is something I cherish.", ENFP
"Engaging in social events and connecting with others is a source of joy for me.", ENFP
"I find inspiration in the dynamic nature of social interactions and relationships.", ENFP
"I'm naturally drawn to social gatherings and enjoy the lively atmosphere they bring.", ENFP
"Meeting new people and making connections is an integral part of my life.", ENFP
"I enjoy being the center of attention and bringing positive energy to social situations.", ENFP
"I enjoy spending time alone, reading books, and reflecting on life.", INFP
"Quiet moments of introspection bring me a deep sense of peace.", INFP
"I find solace in nature and enjoy the tranquility it brings.", INFP
"Deep and meaningful conversations are more fulfilling than small talk for me.", INFP
"I prefer one-on-one interactions over large group settings.", INFP
"Creating art and expressing myself creatively is a therapeutic outlet for me.", INFP
"I value authenticity and seek genuine connections with others.", INFP
"Spending time in my own thoughts and imagination is important to me.", INFP
"I enjoy the beauty of solitude and find it rejuvenating.", INFP
"I'm introspective and often reflect on the deeper meaning of life.", INFP
"Building deep, meaningful relationships is a priority in my life.", INFP
"I'm drawn to the world of ideas and enjoy exploring philosophical concepts.", INFP
"I often retreat to my inner world for inspiration and self-discovery.", INFP
"I find joy in the simple pleasures of life and appreciate quiet moments.", INFP
"Socializing in large groups can be draining for me, and I need time alone to recharge.", INFP
"I enjoy helping others and find fulfillment in making a positive impact.", INFP
"Expressing my emotions through creative outlets is essential for me.", INFP
"I'm a deep thinker, and I enjoy exploring complex ideas and theories.", INFP
"I find beauty in the nuances of life and appreciate the subtleties of human connection.", INFP
"I'm compassionate and value empathy in my interactions with others.", INFP
"I'm comfortable with my own company and cherish moments of solitude.", INFP
"I prefer depth over breadth in relationships, seeking meaningful connections.", INFP
"Engaging in self-reflection is a regular part of my routine.", INFP
"I find joy in helping others and making a positive impact in their lives.", INFP
"Exploring my inner world through creativity is a source of fulfillment.", INFP
"I enjoy the process of self-discovery and understanding my own emotions.", INFP
"Quiet and reflective moments bring me a sense of calm and balance.", INFP
"I value authenticity and am drawn to people who are true to themselves.", INFP
"I'm introspective and often seek to understand the deeper meaning behind experiences.", INFP
"I enjoy creating a personal sanctuary where I can retreat and recharge.", INFP
"I find inspiration in art, literature, and the beauty of the natural world.", INFP
"Deep and meaningful connections with others are essential for my well-being.", INFP
"I appreciate the beauty of silence and value moments of contemplation.", INFP
"I'm drawn to creativity and enjoy expressing myself through various artistic forms.", INFP
"I find solace in my inner world and enjoy exploring my thoughts and emotions.", INFP
"Meaningful and authentic connections with others bring me a sense of fulfillment.", INFP
"I'm attuned to my emotions and find value in exploring their depths.", INFP
"I appreciate the beauty of the mundane and find joy in simple, everyday moments.", INFP
"I'm empathetic and often put myself in others' shoes to understand their perspectives.", INFP
"I seek harmony in my relationships and value open communication.", INFP
"I enjoy delving into my imagination and exploring creative possibilities.", INFP
"Creating a personal space that reflects my inner self is important to me.", INFP
"I'm introspective, and I enjoy examining my thoughts and emotions.", INFP
"I find joy in connecting with others on a deeper, emotional level.", INFP
"Seeking understanding and meaning in life is a continuous journey for me.", INFP
"I'm drawn to the emotional depth of art and literature.", INFP
"I appreciate the beauty of introspection and enjoy exploring my inner world.", INFP
"Meaningful connections with others bring a profound sense of satisfaction.", INFP
"I value authenticity and honesty in my interactions with others.", INFP
"I find peace in moments of solitude and enjoy quiet, reflective activities.", INFP
"Creating a personal haven that aligns with my values is important to me.", INFP
"I'm attuned to the emotions of those around me and strive to provide support.", INFP
"Deep, philosophical discussions about life and meaning resonate with me.", INFP
"I find joy in exploring my inner thoughts and emotions through creative expression.", INFP
"I value depth and authenticity in my relationships, seeking meaningful connections.", INFP
"Quiet moments of contemplation and introspection bring me a sense of tranquility.", INFP
"I find beauty in the subtleties of life and appreciate the richness of human emotions.", INFP
"Creating meaningful connections with others is a priority in my life.", INFP
"I seek understanding and empathy in my interactions with others.", INFP
"Exploring my inner world and understanding my emotions is an ongoing journey for me.", INFP
"I find fulfillment in helping others and making a positive impact in their lives.", INFP
"Meaningful and authentic connections with others bring a deep sense of joy.", INFP
"I appreciate the beauty of introspection and find joy in exploring my inner thoughts.", INFP
"I value the richness of human emotions and enjoy exploring their depths.", INFP
"I seek authenticity in my interactions with others and value genuine connections.", INFP
"Creating a personal sanctuary that reflects my inner self is important to me.", INFP
"I find joy in the beauty of silence and value quiet moments of reflection.", INFP
"I'm drawn to the emotional depth of art and literature, finding inspiration in their stories.", INFP
"Meaningful and authentic connections with others bring me a profound sense of fulfillment.", INFP
"I'm attuned to my emotions and appreciate the beauty of introspection.", INFP
"I seek understanding and meaning in life through introspective exploration.", INFP
"I find joy in connecting with others on a deeper, emotional level.", INFP
"Exploring my inner world and understanding my emotions is a continuous journey for me.", INFP
"I'm drawn to the beauty of introspection and value moments of quiet contemplation.", INFP
"Creating meaningful connections with others is a priority in my life.", INFP
"I seek understanding and empathy in my interactions with others.", INFP
"Exploring my inner world and understanding my emotions is an ongoing journey for me.", INFP
"I find fulfillment in helping others and making a positive impact in their lives.", INFP
"Meaningful and authentic connections with others bring a deep sense of joy.", INFP
"I appreciate the beauty of introspection and find joy in exploring my inner thoughts.", INFP
"I value the richness of human emotions and enjoy exploring their depths.", INFP
"I seek authenticity in my interactions with others and value genuine connections.", INFP
"Creating a personal sanctuary that reflects my inner self is important to me.", INFP
"I find joy in the beauty of silence and value quiet moments of reflection.", INFP
"I'm drawn to the emotional depth of art and literature, finding inspiration in their stories.", INFP
"Meaningful and authentic connections with others bring me a profound sense of fulfillment.", INFP
"I'm attuned to my emotions and appreciate the beauty of introspection.", INFP
"I seek understanding and meaning in life through introspective exploration.", INFP
"I find joy in connecting with others on a deeper, emotional level.", INFP
"Exploring my inner world and understanding my emotions is a continuous journey for me.", INFP
"I'm drawn to the beauty of introspection and value moments of quiet contemplation.", INFP
"I'm always up for a spontaneous road trip with friends.", ENFP
"I find excitement in exploring new hobbies and interests.", ENFP
"Creating a vibrant and energetic atmosphere is my specialty.", ENFP
"I love connecting with people from different cultures and backgrounds.", ENFP
"Organizing social events and gatherings brings me immense joy.", ENFP
"I'm drawn to the energy of live performances and events.", ENFP
"Spontaneous dance parties at home are a regular occurrence for me.", ENFP
"I'm passionate about advocating for causes I believe in.", ENFP
"Exploring different cuisines with friends is one of my favorite activities.", ENFP
"I enjoy taking on new challenges and embracing change.", ENFP
"I'm known for my positive outlook and uplifting others.", ENFP
"Finding inspiration in the world around me is a constant pursuit.", ENFP
"Sharing laughter and creating a light-hearted atmosphere is important to me.", ENFP
"I thrive in collaborative projects and enjoy team dynamics.", ENFP
"Adapting to new environments and meeting diverse people is exciting.", ENFP
"I find joy in expressing myself through various forms of art.", ENFP
"Creating playlists for different moods and occasions is a favorite pastime.", ENFP
"I'm always open to trying out new and adventurous activities.", ENFP
"Engaging in deep conversations about life and possibilities is invigorating.", ENFP
"I'm drawn to the creativity and innovation in the world.", ENFP
"Exploring hidden gems in the city and sharing them with friends is a passion.", ENFP
"I enjoy the thrill of exploring new opportunities and possibilities.", ENFP
"Creating a positive and inclusive community is a goal of mine.", ENFP
"I find inspiration in the diversity of perspectives and ideas.", ENFP
"Being involved in social causes and making a difference is fulfilling.", ENFP
"I enjoy hosting themed parties and events for friends.", ENFP
"Finding beauty in the ordinary and mundane is a unique talent of mine.", ENFP
"I love attending festivals and immersing myself in the lively atmosphere.", ENFP
"Spreading joy and positivity is a mission in my daily interactions.", ENFP
"I'm always seeking ways to bring people together and foster connections.", ENFP
"Embracing spontaneity and going with the flow is my approach to life.", ENFP
"I find inspiration in the vibrant colors and energy of urban landscapes.", ENFP
"Creating a personal brand that reflects my values is important to me.", ENFP
"I'm drawn to the magic of storytelling and enjoy creating narratives.", ENFP
"I enjoy turning everyday moments into memorable experiences.", ENFP
"Organizing surprise celebrations for friends is a frequent occurrence.", ENFP
"I find fulfillment in contributing positively to the lives of those around me.", ENFP
"Capturing moments through photography is a creative outlet for me.", ENFP
"I'm naturally curious and love exploring new possibilities and ideas.", ENFP
"I enjoy the challenge of multitasking and juggling various interests.", ENFP
"Creating a supportive and uplifting community is a constant endeavor.", ENFP
"I'm passionate about championing the talents and creativity of others.", ENFP
"Transforming ideas into reality through collaboration is a satisfying process.", ENFP
"I find joy in bringing people together for shared experiences.", ENFP
"I'm drawn to the vibrancy of street art and unique expressions of creativity.", ENFP
"Facilitating group activities that encourage bonding and connection is a strength.", ENFP
"Adapting to change with enthusiasm and openness is part of my nature.", ENFP
"Exploring fictional worlds through literature is a favorite pastime.", INFP
"I'm known for my ability to empathize and understand others deeply.", INFP
"Being in nature is a spiritual experience that rejuvenates me.", INFP
"I enjoy creating a cozy and serene space for introspection.", INFP
"Listening to soulful music is a way for me to connect with my emotions.", INFP
